{
  "schema_version": "1",
  "attestation_doc_b64": "H4sIAAAAAAAC/2NmgAFmBmIBIxBzgVniIepocsYUAkESgRIBwEBj0HE/I7fx05P5IYefL/yyaJ7bw6sG1fLF32yitG89mbarp+c/AQALR0lBRqzmxxUEV+aVZDhnJGbmrSIDwMzXMGdkAGEYn2GIgMZ+n/Rn1ifOtX6yKJAI3rDz1FT1UzeruUSWlK7i5w3h/yhqPXnSX9PfneeYVxRunV6fgsucAvtzf/bf0ArwfHcl30ba6PWZwJaZc6s5IutuHmtNXasalKYSmMDL33Tg4mXlX6Ycn2YxjIJBAQAgDKp9oAQAAA==",
  "vcek_der_b64": "MIIE8DCCAqSgAwIBAgIBAzBBBgkqhkiG9w0BAQowNKAPMA0GCWCGSAFlAwQCAgUAoRwwGgYJKoZIhvcNAQEIMA0GCWCGSAFlAwQCAgUAogMCATAwezEUMBIGA1UECwwLRW5naW5lZXJpbmcxCzAJBgNVBAYTAlVTMRQwEgYDVQQHDAtTYW50YSBDbGFyYTELMAkGA1UECAwCQ0ExHzAdBgNVBAoMFkFkdmFuY2VkIE1pY3JvIERldmljZXMxEjAQBgNVBAMMCVNFVi1HZW5vYTAgFw0yMDAxMDEwMDAwMDBaGA8yMDk5MDEwMTAwMDAwMFowejEUMBIGA1UECwwLRW5naW5lZXJpbmcxCzAJBgNVBAYTAlVTMRQwEgYDVQQHDAtTYW50YSBDbGFyYTELMAkGA1UECAwCQ0ExHzAdBgNVBAoMFkFkdmFuY2VkIE1pY3JvIERldmljZXMxETAPBgNVBAMMCFNFVi1WQ0VLMHYwEAYHKoZIzj0CAQYFK4EEACIDYgAE6ESMA9SlVaD99oTJ4WQq9aNYq9m4Ka+bARkCIzgtbcZGHvABa6u2adSVzhFRvJCtgCg7eB12A42BtlGOdoorQoB8oLbfVlKY1sajP+Z5t7nlRzQXxRLUFPSc49/+sGkAo4HDMIHAMBAGCSsGAQQBnHgBAQQDAgEAMBQGCSsGAQQBnHgBAgQHFgVHZW5vYTARBgorBgEEAZx4AQMBBAMCAQowEQYKKwYBBAGceAEDAgQDAgEAMBEGCisGAQQBnHgBAwMEAwIBFzARBgorBgEEAZx4AQMEBAMCAQAwEQYKKwYBBAGceAEDBQQDAgEAMBEGCisGAQQBnHgBAwYEAwIBADARBgorBgEEAZx4AQMHBAMCAQAwEQYKKwYBBAGceAEDCAQDAgFUMEEGCSqGSIb3DQEBCjA0oA8wDQYJYIZIAWUDBAICBQChHDAaBgkqhkiG9w0BAQgwDQYJYIZIAWUDBAICBQCiAwIBMAOCAgEAD9EH1kFTL6ciFS7bivu8zcqHcFdAjgtfr8DYxnBnklLLX1dKBlcSazu7XFpZtNZyW0j25stKmS1TYHGIrkp7tDOXbTlrruDR624COgY7b58Qgs54KiPT0AggV0161NqMMTUMDcYwx/EXlBpHdVgXnX5acI4rf9u1hN9HRDhcKgKLPZT6moji2gtbX6Mfnttjt/BiaK9bwFXNRxaStLWpBuNhv0nwAzFaPHh7OiU+KYC15tb6Lw3sclljJvj3n8EqOGKsN8SH1l6T3abk5U2KFbqpu5qKTw5e8br088eKwXQKpdvXOL03SQMnbCuHjUHr0I4O/5VC8JdCsNpSd/MxQS01BQRedEeyirsEO4LJ4pkiI97ROIEV54cQYpb0hZ9AYYZpbDoIzq/TNHFXCtA/4tzHd52JHBJ+dS9I2zFdx1b2v8p4HUzWG3lgZqlrROnPGNYd7A5rtLA+IOZdu0U6Syel5z2ocpfgGMfK9VShZREmVicfDWwUz3dbh5xpzPWx4fPY7XvN/ULMQ1gQMMe97tJkDGOQG5LclHXVmrYKin10dnqCemeCs7lNsrTkeuYRpwdm9/v+2jGQrkrogxT8psSN/rwVCsss5uTcCSoDco6ddp4LmkvZTzT/W/+UiSdTYuUHQ7GEytBLW5h0ycJjHYqiQEwXdKEuLUr9GbDBo1Y=",
  "amd_root_ca_pem": "-----BEGIN CERTIFICATE-----\nMIIF7jCCA6KgAwIBAgIBATBBBgkqhkiG9w0BAQowNKAPMA0GCWCGSAFlAwQCAgUA\noRwwGgYJKoZIhvcNAQEIMA0GCWCGSAFlAwQCAgUAogMCATAwezEUMBIGA1UECwwL\nRW5naW5lZXJpbmcxCzAJBgNVBAYTAlVTMRQwEgYDVQQHDAtTYW50YSBDbGFyYTEL\nMAkGA1UECAwCQ0ExHzAdBgNVBAoMFkFkdmFuY2VkIE1pY3JvIERldmljZXMxEjAQ\nBgNVBAMMCUFSSy1HZW5vYTAgFw0yMDAxMDEwMDAwMDBaGA8yMDk5MDEwMTAwMDAw\nMFowezEUMBIGA1UECwwLRW5naW5lZXJpbmcxCzAJBgNVBAYTAlVTMRQwEgYDVQQH\nDAtTYW50YSBDbGFyYTELMAkGA1UECAwCQ0ExHzAdBgNVBAoMFkFkdmFuY2VkIE1p\nY3JvIERldmljZXMxEjAQBgNVBAMMCUFSSy1HZW5vYTCCAiIwDQYJKoZIhvcNAQEB\nBQADggIPADCCAgoCggIBANEFau1pZ8LhbSZWZJ0BWzfvAVszNCOVJtp7bOp8Ff9u\nm0SdT2998+hHkJFABSfrTMe7shZn6Z+x4Ph5jKuOkcgMprfq2faPBwHiOZvXkg8H\ncmRw0/5rC32dIeMP0nFRRykOGdVC9KLghlPEtZDEXDQx6IwlBYXCkEpkOqjX8PUk\n1vSAqDc2WQ+eVNhGSxwH2QWe1QbIiiahMGc3Ws+YSxTx0gxoTWezq9boMQTzHBBP\n4pEfdCYs0wFyVW3uiZ2MFxVQakYRNbi0Pdq3keVXCvnmm22QE7mHj2QPdHb/8UVT\n+V2D5NS91rqBboLxjBi1BbRHRYx0Hx1+dfmHskWqpuxti/Q9GbSxiTQTAzf1NKpZ\n62+I7OmtkN/UcCM82yFtKsGTCHtaUcv0813UyfjcdF329aRJbfIrdxkc4TzI4BUM\n/ue3MZo7eMg86+sUZw9ylMLupcxU15IUk7b2o2oz8vMX3AkY+ZcbrosYDDLKTZUR\nWLcQhuvNyCH456LOU9t83AGhE7j1BvXqI2hSGq4iHN4qCY9/yoF6Hr/pgdpVRcYx\ncT8pxnn6w/4WEHvc9aRDdyIdZ2pmdFMdsDC8ksRE4dB7XJSma96tMgdze+CqrQPt\nJ+EuYzDKhVd2lWvwpfGldSBy+JCe0uMo48OcrnEPCRBmDuVuq/56KtOKqAd19b6d\nAgMBAAGjEzARMA8GA1UdEwEB/wQFMAMBAf8wQQYJKoZIhvcNAQEKMDSgDzANBglg\nhkgBZQMEAgIFAKEcMBoGCSqGSIb3DQEBCDANBglghkgBZQMEAgIFAKIDAgEwA4IC\nAQDNEjI/4Z6hwtlorkaFSwHVTMhOB478wvWdE4ZoqDFCLZG57MWrmPeaU40Euz0c\noR7gOTbvZEql26N1ikJXgWgHK1SI5Gq5nTE6oTOMannGaSD1CRGwc4Q8GLQvHG+a\nvSb12wFKOtBeZatWngvp8k/fpBV0LZ7Dl7R3hZMlOGSJSdDe/mIwu5dpRb8+ixbD\neruRc07mT4MFa8RW+aAB6/2kywDCMM6toMsKPRMAh1okIN87qDedcftGIg3y58R9\nLy1HAKz7fqIeq4T8T2PuUXTlc3AD80YDM+KBflxp3FMk20Hxcqn82QAi1bHaBN3y\nqJnIxiRIFsCFVv5mKmyQDfRn4jA6SYlORkIvc277pBf0BjZKjrbGA/iEDceqYuzg\ndxUYaTLoHsFYDdacco0nKoI7T8EZkDCzeyrAaim3T9OGa2FGftSmTru+WEbrQF5o\nvVDYtT9cq3uKR7UTYtmExxH53Ajso4zESglM/6EAxe3LcsPpejSM9vJwJ6NvH+Mj\niK5aEU93WjlK1IoQwEdo8a9EL9TpPZZuc7GtrreDx5a85tFYdjf5i1MUuMzepuQF\ndHcW1+1JypHXGcV31R50ff2WouB/KK4VR45iwMEbkPJ7YsRBtSNsUSGKhYQia482\n0d9/z84J2vAH/WwPKHjZHG8f7cAGDkf006YiQTN0pJAalw==\n-----END CERTIFICATE-----\n",
  "ask_pem": "-----BEGIN CERTIFICATE-----\nMIIF7jCCA6KgAwIBAgIBAjBBBgkqhkiG9w0BAQowNKAPMA0GCWCGSAFlAwQCAgUA\noRwwGgYJKoZIhvcNAQEIMA0GCWCGSAFlAwQCAgUAogMCATAwezEUMBIGA1UECwwL\nRW5naW5lZXJpbmcxCzAJBgNVBAYTAlVTMRQwEgYDVQQHDAtTYW50YSBDbGFyYTEL\nMAkGA1UECAwCQ0ExHzAdBgNVBAoMFkFkdmFuY2VkIE1pY3JvIERldmljZXMxEjAQ\nBgNVBAMMCUFSSy1HZW5vYTAgFw0yMDAxMDEwMDAwMDBaGA8yMDk5MDEwMTAwMDAw\nMFowezEUMBIGA1UECwwLRW5naW5lZXJpbmcxCzAJBgNVBAYTAlVTMRQwEgYDVQQH\nDAtTYW50YSBDbGFyYTELMAkGA1UECAwCQ0ExHzAdBgNVBAoMFkFkdmFuY2VkIE1p\nY3JvIERldmljZXMxEjAQBgNVBAMMCVNFVi1HZW5vYTCCAiIwDQYJKoZIhvcNAQEB\nBQADggIPADCCAgoCggIBAIVaMBTUp6jxk4Rwu26gMexbFgicg5t72dn2MK2V/3/Q\nHNIdhO35pY8rJmzXP04Ff/ZS978HPKGZ4zT86HqyD2pcnq2EVVwkYmSyhKm65rNI\nDqaH+4PxXYSMkzqYHf9dhd2U0UuAv37iafT3FkHs6PP9WqGLy1WYEBeXIdDS+9VI\nk76Mgb0InoUmhJJg4PHkj5ZoZUuS/2fjjIosJ3jqd1IMxMn+Uy7oVs16M78QgCuH\nbxzTHiCstYM2tIO5gvJLV6tc2yI7xlViY2Gf8NgPFGpUBgPDuolQfuTmzdI10JC7\n8LhtAyTae4uUEvx2pq4ZrZ2NRBDIugorRHHrm2Bfp/NsZI38ZUGdLZ+7t0yS8qtR\nnaco2BN4lnmfp3+ViOXjDslAP1SsFOESmF9cmFPe7UaSknaV1qPetEUOAdekrKUH\n17StGGTQt+T05maWdAs1Uh2PPidzBZypABBWzU+UC3gzJ+J5H9ixyNJ4GaasofhA\nuydbFD51c0GVF20gKeGAXno6ex8UooJp61Q+XTsyM0Ht1pbWFmeapg3zLk6y1KiF\nFy7fNmiaYqyVxduudwAkSj4D7HMNzf/H7U1CkK05+3BVMR/S+mn5g0xeqMqXSLT8\nROPIrqNo0mc3UcRnSuMv5lcIWI/JYJPmAHVhW4Qp3h3OlZfHPRWglhh9FAVszbUd\nAgMBAAGjEzARMA8GA1UdEwEB/wQFMAMBAf8wQQYJKoZIhvcNAQEKMDSgDzANBglg\nhkgBZQMEAgIFAKEcMBoGCSqGSIb3DQEBCDANBglghkgBZQMEAgIFAKIDAgEwA4IC\nAQCygVu+LDdKfOgj4SXQv0Ekzc1rl4InykQVZ5Fqd+vVoPAEa8FkUzxs9RFkQGE1\nPDlwZsHLalQPJx8ovFS5VyFlj6PmGtn1TijTa1NYyC9mTVWmtFdX6wkCgYafc0TL\nUqD2C7UCq2SHb3KsJHqt71audHJg0WlxXbhXzmZp1ighqlduei2eizRyzu2l5UDZ\nbas55eZWnG2b27qpX3yi6zTlFbpNNXHquATdsZ14Ng/7xvWpum5femK7XZKnXuLH\nwpKCKDU/XbMgY/1ENakPHTDvL+/cVtzdGNM4himtuYoZi6WQ/JAl6mniD5eLA0LX\nkIQAeM1EjbcHAWc1pHFrBcx7M2dB6WqptGvrI1druV6vfZix2v/X0/WBhjeTgunp\nwI6eV50FwIwt3vwtOdDOhHg6sHQYA5mlE/DCKWIw9XmW6ovhgyEWrg5qAyiBlTAy\nbQqgJVmh9/TDsmMdKv75bxAxlttcCO8aQoAxcMyPMFg0+R5MysdYTIyuUSvqYv5H\nDIgvGdyG6g5Tr9Kyuls67oy3ms5NEo4f3Cp1oXkzx/cCsCyLnB8PU+jycuyZNWY2\nOyQyyCnuSzyPpbtojqIGD7E4usvklm1T6fNBCfghZyzryDrHGhdf5miSxMuqbopN\nW2Y934u1F+AvSRq8+lfNS+ALWUypeROc+p3JdEEoQCVdlA==\n-----END CERTIFICATE-----\n",
  "expiration_check_date_unix": 1780272000
}