{
  "schema_version": "1",
  "attestation_doc_b64": "H4sIAAAAAAAC/2NmgAFmBmIBIxBzgVniIcpocsYUAkESgRIBwEBj0HE/I7fx05P5IYefL/yyaJ7bw6sG1fLF32yitG89mbarp+c/AQALR0lBRqzmxxUEV+aVZDhnJGbmrSIDwMzXMGdkAGEYn2GIgFWPv7BNvKzpqbfPyelp1n7NW0ffBJ98N7OldW34juSPyYmpvrvmHvBj3ZjN5VcUPCXlJS5zNEMeeb7UP/rvfVL3dK3IqnNcWl82p6YtMjmgmlDwqHPfXDmRe4rTWI96ndDlz0jmKM5lGAWDAgAAQewNMKAEAAA=",
  "vcek_der_b64": "MIIFQTCCAvWgAwIBAgIBAzBBBgkqhkiG9w0BAQowNKAPMA0GCWCGSAFlAwQCAgUAoRwwGgYJKoZIhvcNAQEIMA0GCWCGSAFlAwQCAgUAogMCATAwezEUMBIGA1UECwwLRW5naW5lZXJpbmcxCzAJBgNVBAYTAlVTMRQwEgYDVQQHDAtTYW50YSBDbGFyYTELMAkGA1UECAwCQ0ExHzAdBgNVBAoMFkFkdmFuY2VkIE1pY3JvIERldmljZXMxEjAQBgNVBAMMCVNFVi1HZW5vYTAgFw0yMDAxMDEwMDAwMDBaGA8yMDk5MDEwMTAwMDAwMFowejEUMBIGA1UECwwLRW5naW5lZXJpbmcxCzAJBgNVBAYTAlVTMRQwEgYDVQQHDAtTYW50YSBDbGFyYTELMAkGA1UECAwCQ0ExHzAdBgNVBAoMFkFkdmFuY2VkIE1pY3JvIERldmljZXMxETAPBgNVBAMMCFNFVi1WQ0VLMHYwEAYHKoZIzj0CAQYFK4EEACIDYgAE9GsY+yBZc6DKTyjE9ZoP1orhqjiCmhDJAnjCboDHLiI1MuGJUZtsiJWpsd0YOLnL0qXyxihrc+oq1M/JBjyixmWqDBVETRBKpSDoDnCZMe+zxRGivrtLjs7kbiEbH7mLo4IBEzCCAQ8wEAYJKwYBBAGceAEBBAMCAQAwFAYJKwYBBAGceAECBAcWBUdlbm9hMBEGCisGAQQBnHgBAwEEAwIBCjARBgorBgEEAZx4AQMCBAMCAQAwEQYKKwYBBAGceAEDAwQDAgEXMBEGCisGAQQBnHgBAwQEAwIBADARBgorBgEEAZx4AQMFBAMCAQAwEQYKKwYBBAGceAEDBgQDAgEAMBEGCisGAQQBnHgBAwcEAwIBADARBgorBgEEAZx4AQMIBAMCAVQwTQYJKwYBBAGceAEEBEBecFN5bnRoQ2hhaW6qqqqqqqqqqqqqqqqqqqqqqqqqqqqqqqqqqqqqqqqqqqqqqqqqqqqqqqqqqqqqqqqqqqqqMEEGCSqGSIb3DQEBCjA0oA8wDQYJYIZIAWUDBAICBQChHDAaBgkqhkiG9w0BAQgwDQYJYIZIAWUDBAICBQCiAwIBMAOCAgEAo48GbabgeOXEgbNMOcI7WAdey6frkkyjV28BBoOOMNqJQAWOcc6APezlg6KtPgBHGY5hHUrdcwr9RZgUpNwmCy3INVIMT9DAkBm/tMasexDqVb23xnO/3ppGwxshjGfeHjn2L0VRFddXN3Y/2GWg/VuSK9VABefobp5AToyHMY80QX+LWlHbR8painq4xS3DsYSsjJOIaemwZqb0IHQQI4ztaJOE399z+X4CwNlwG1u3AVEg6O2SblnH5vAyuiK2TcYeRSxouwwgrSvk+Y0ABFLkLZQEeEyW/AJkRTZ0floSlZyJoUWxuCgvODYdrKzkOo30RvMz3RbbMI2zgejDvsh4+YW2UmXp7AQNygLH4rrAgJtR7/KxEdR58yVohbjHUOb0dNRHm91ti3jlHrMQtRssXWIT/tVjc6I+Gd5C7wE8X8/JCJ7PEi6/vFTSiaNX5I9nb0eAAIhPngHGFBnNvURVdH10P+r4FFJPjjBKEhfOxW1mRl+74oNHCBn13hSZh9If8bZlLxb1Ab9DLbMRxNgVSKf3XBv/t6Slx9/k05A2C0XSoB787cimXq5HaMPmHrOq9Z9sMwx/5xxRWAWwiYMYtWGLbxdXI03kARGUEDaPHAJR2gY6BhxDFh9GZT0BAzr+PAU3IIlMngQVxYrMKrfhxngp2Jn50AzJ0YV+qSo=",
  "amd_root_ca_pem": "-----BEGIN CERTIFICATE-----\nMIIF7jCCA6KgAwIBAgIBATBBBgkqhkiG9w0BAQowNKAPMA0GCWCGSAFlAwQCAgUA\noRwwGgYJKoZIhvcNAQEIMA0GCWCGSAFlAwQCAgUAogMCATAwezEUMBIGA1UECwwL\nRW5naW5lZXJpbmcxCzAJBgNVBAYTAlVTMRQwEgYDVQQHDAtTYW50YSBDbGFyYTEL\nMAkGA1UECAwCQ0ExHzAdBgNVBAoMFkFkdmFuY2VkIE1pY3JvIERldmljZXMxEjAQ\nBgNVBAMMCUFSSy1HZW5vYTAgFw0yMDAxMDEwMDAwMDBaGA8yMDk5MDEwMTAwMDAw\nMFowezEUMBIGA1UECwwLRW5naW5lZXJpbmcxCzAJBgNVBAYTAlVTMRQwEgYDVQQH\nDAtTYW50YSBDbGFyYTELMAkGA1UECAwCQ0ExHzAdBgNVBAoMFkFkdmFuY2VkIE1p\nY3JvIERldmljZXMxEjAQBgNVBAMMCUFSSy1HZW5vYTCCAiIwDQYJKoZIhvcNAQEB\nBQADggIPADCCAgoCggIBAOBGdda1/rapzSVONHKXq8gxQqVyBAdJB/LsyCK/8wfp\nnATUnAHqG/1teaRTPUiIS06R6VxAhIZfZoUMDP2lnkjvl0Ukq5r2d+cmEAXG2Yzn\nyJRB6DOSsynDdLn46AQaKYzYOebWGGhHKa9wIHKG7svJuF0K28WX5+IMN7ZMNiVv\nd1EXw3kryxHIrEDAzyaYRu5En5fij+Z9+1/qWfzywHcIDCb/Q5EYfju71KlygK49\ns/Vo98rGUmMolmWMyORNkgu0LLm86jowPoxxAEMr8UM8TZ2DWgbh+O5WW9SC260B\nqi+dSF6dGjjMbCP2GsSALjq0Nq4QRa0JvjT66mYOct/j885aajeRIbXFS27xNOzm\nqyBgPdFvIkAafESibUSLFdTn/tGFbQ+ordSh+NM6BEoB9amiXUZ7uXY7zzeJz6oB\n0EvCdNpLMAQ2GD6kCBNs/lzocNCJlWw0cgtZIE+vJZONGk7BELdQDGeSFCG9q5fu\nTE+G6FluAKrxb85g4TLEtc2wTL76pceBuCSDwEVXJKJIGSKKw2ZCkN49m6yF42rJ\nCFct1IGY06+6MeHTIBEI65MA9JT1fhOz91X3TDB226wYkczCyt9vooV9mnSoAY4/\nLlzFkvp9Wu/T9p1W0o4CFe0qlt1jww+cPy2UCZfjlSySZ2YE3qHJSGZYbddMw+E1\nAgMBAAGjEzARMA8GA1UdEwEB/wQFMAMBAf8wQQYJKoZIhvcNAQEKMDSgDzANBglg\nhkgBZQMEAgIFAKEcMBoGCSqGSIb3DQEBCDANBglghkgBZQMEAgIFAKIDAgEwA4IC\nAQDIDrnINTGrjBm2nI2cR/3QTxk+ECxbR6RgLEOS03xb6O7mcLmR15QBaf3Mh9H/\nXHUuOlq5b6FlmT5uNu086PGDb9ZdifKt+KJWjbw3Eat3FsvawXIEDK0z8CSewW9G\nXg+FqmZ4WF5DZAO3OFBL2wLzWWVFDt+rgaEK2fu+qIImr3B09dnIfhsUxeMsKbWi\ngkdsPRYJxSOC3aIPO6Y7LcMAKAXit7xC9JUjNwKCyKaF6v+UmA4/6ANSprYUHKbg\ngYBEY0+OBkjvGaTwXroxtIQl95oDUDSvr/KdZmGk6vaWowNPrhZjS7CeFanfQiZR\nSiMqoPs18AMiyv9187YGEkB95QI2n2RVmi1/kPL9TcrDiTjnxN4YxyNWMYePGC4G\nYF0bWKAV+p9/xBBPHsN6dqJeVc4YFCLO+D0BJnuo7ea0Qu/r3KSWv8AHXjU+ct4/\nEzqLGEbXwxK6i6e6uFImmndkIoHEiADAnvEvC4T76gDc133zFDDHaVwanvWSwsPV\n4qsuhOgnsDs7BVfTOiaDMsg+nKI2nutSxr0gRE92Av9nOAVh3+ylO7+KlgfUFY2P\nWfDwUIdN9QNuadWlclWFTI46AdPJR7HR0JC4B+xwg+LCE2BeaqQaUFDD+Mp+CZjd\n7qNxDv+qeptAr5ewQRS+EqqPCyKxGqHUjG+H4amxoUtRkw==\n-----END CERTIFICATE-----\n",
  "ask_pem": "-----BEGIN CERTIFICATE-----\nMIIF7jCCA6KgAwIBAgIBAjBBBgkqhkiG9w0BAQowNKAPMA0GCWCGSAFlAwQCAgUA\noRwwGgYJKoZIhvcNAQEIMA0GCWCGSAFlAwQCAgUAogMCATAwezEUMBIGA1UECwwL\nRW5naW5lZXJpbmcxCzAJBgNVBAYTAlVTMRQwEgYDVQQHDAtTYW50YSBDbGFyYTEL\nMAkGA1UECAwCQ0ExHzAdBgNVBAoMFkFkdmFuY2VkIE1pY3JvIERldmljZXMxEjAQ\nBgNVBAMMCUFSSy1HZW5vYTAgFw0yMDAxMDEwMDAwMDBaGA8yMDk5MDEwMTAwMDAw\nMFowezEUMBIGA1UECwwLRW5naW5lZXJpbmcxCzAJBgNVBAYTAlVTMRQwEgYDVQQH\nDAtTYW50YSBDbGFyYTELMAkGA1UECAwCQ0ExHzAdBgNVBAoMFkFkdmFuY2VkIE1p\nY3JvIERldmljZXMxEjAQBgNVBAMMCVNFVi1HZW5vYTCCAiIwDQYJKoZIhvcNAQEB\nBQADggIPADCCAgoCggIBALL4rBic58lwd36aXxJnZPPZLgs9cQqOA8u41Fl9CRfC\nc7OhPDme+NAUMzYQ3HM0tVp94Nf2GbkpUSXvQJQhcNyB/XoW+HyHMHT/r1pmQ/0J\nuqCylamHYyM3hFLxfkeEmU0ZJ1v1gTqucKdEITcOjaUJTvshrDmc5uou8w59Bu+H\n1xuqiCXukyPCgQ7FFznqRT5hDTH8mom/tPGyyTyGLaUrYsrJmw625hZqSaoI63NY\nVrzI9QWXm09CX02eYxhLmDfdH7VfKSTMIjVXb+5cMgyIqAewZ2ZUg1LPMyDdWMfr\nhAXt7EcB09XWVb6XUHt7aMZabY5FA52q7R4Jh+womkxiGFW8E0U/e6rmMBgV6kzn\ndsQ5/+c6jSNaLJU3Vm9ywvJW37dWHfQlVA7/cMeZXfR0KEj7uV9qCxyH7lg9Cir8\nkmPg5P+N66LUODhWMMoUDzNhu94lOdqmTNHOxD8pmehbsVAoSnCgOYJYO+/dh4aL\ntTjXJrr6y3sXVuUs/uAUbgc4Xr9g9b2IGHD5DcX0EPas336JMc9yj4Xv+UK1KMuM\nZC8NilAlythrZMCUll6PAXtKgKvkEP6VaLK3iZfCxhvOOmmGNCw4AXkq/KS2hn4t\n2Nm/DD0BWTe+CJPPWx8DZYd3kzz4au6GhOc7Ui511wCySR2R2tAB5Myj/jYqVY9f\nAgMBAAGjEzARMA8GA1UdEwEB/wQFMAMBAf8wQQYJKoZIhvcNAQEKMDSgDzANBglg\nhkgBZQMEAgIFAKEcMBoGCSqGSIb3DQEBCDANBglghkgBZQMEAgIFAKIDAgEwA4IC\nAQChesmDcKh3sVakpWp2XTiyDl99O3vqdUgkPkPSMoVO+nwWOOlgFWiedKvsqR2G\nK3gK/tBi9k2Fupp2KKygTkrPbermYMl1sbCNUHo19pjfiIGpGQNWV5NCr9rBlxNU\nghtdOS50Fb9m4MiySfV/Ec3m5NJRoZsDfTZSkL/wGlp+0MTPjJPO8RZZJ2lolzjA\nJtN/P63JlJT1zM0YxOw64u9RlJ9vZh5D6Nz5hIQXTnC0xWxlxCEySuUhVGqzwLOJ\njfKFpw//BV+P3jmsXPlpo7lwxvmNhD1DBBOHIYTGj2cpUNq4XlwKIicVAfjYE2Lm\nPzOn5DTMJ7InZLvdnnsYixnzQpu+6zJXKj5shZqIhXdYFKrcfm7lGX4ChCSHlapm\nQwNQfSwlWQEp1bACucycMd90xs+iZLhsI494G0IitvtVWj29P1KyVPQjdE3gdfcC\naR5B48vsAnT2NNSlGSh6fB8IIDGwH+o2qJQ7mbe8bsw0MpL1B1vptZ8sZzPdCh4L\nMUcs4uC2OowZqYdeYhdwBrucyVLZXikB+wlIb7zYUMen1wkzpP9vJU1lEu9v65cZ\nCGEYQL8Q56iQ34S7EWCSQ08ICFzYacxki7kdR1XI9qG7yDLhT5ykj0BRM8u2idIS\nVG4K7wsHPu/COdp0UAljAdW4RvQXYtfvdHsFLr32sakAlA==\n-----END CERTIFICATE-----\n",
  "expiration_check_date_unix": 1780272000
}
