{
  "schema_version": "1",
  "attestation_doc_b64": "H4sIAAAAAAAA/2JmgAEEixBgZGBg4AKzxEPU0eQKD8ubXtqQUL57XY3sfZ4jTCwcJz7Pydjg8/mC5hXuu67PTVMr5P2eTzu/0eW+luHidXHtJdVbd01c9Se74dGjjB0Jtpzvjdb85D//Oont4pIcYZGY98V5u3fYS7z6n8GdkWTELOr2P/7yHJfIaTPftZuc3rdVkmhH0wh03M/Ibfz0ZH7I4ecLvyya5/bwqkG1fPE3myjtW0+m7erp+U8AwMJRUpARq/lSH1flyIcxV7G2zIrc0RjzkzPCfvbK9/qsRhJHzD9bL2x+8kR0g+Xm+iZWVa6L8d0dCxavvfnlQOOB8lkeb5VEzPtcYOZrmDMygDCMT8cgoggseLbF3fHNyhMfkp14Tt2tOBbqcPZC0Zd5kfsrEv/dmt3tZS5uXmxfuWZ75qLTa8SWZu3GZU4EWwXDpy3OT8x6vSw+mS7VvJf6aK3H172WM5dM7XXsmTo53ULbabUdr4hD+Q3VOivHD/T15SjABQABAAD///KGZEWgBAAA",
  "vcek_der_b64": "MIIFPzCCAvOgAwIBAgIBADBBBgkqhkiG9w0BAQowNKAPMA0GCWCGSAFlAwQCAgUAoRwwGgYJKoZIhvcNAQEIMA0GCWCGSAFlAwQCAgUAogMCATAwezEUMBIGA1UECwwLRW5naW5lZXJpbmcxCzAJBgNVBAYTAlVTMRQwEgYDVQQHDAtTYW50YSBDbGFyYTELMAkGA1UECAwCQ0ExHzAdBgNVBAoMFkFkdmFuY2VkIE1pY3JvIERldmljZXMxEjAQBgNVBAMMCVNFVi1HZW5vYTAeFw0yNjAxMTExNjM4NTZaFw0zMzAxMTExNjM4NTZaMHoxFDASBgNVBAsMC0VuZ2luZWVyaW5nMQswCQYDVQQGEwJVUzEUMBIGA1UEBwwLU2FudGEgQ2xhcmExCzAJBgNVBAgMAkNBMR8wHQYDVQQKDBZBZHZhbmNlZCBNaWNybyBEZXZpY2VzMREwDwYDVQQDDAhTRVYtVkNFSzB2MBAGByqGSM49AgEGBSuBBAAiA2IABHojLunW8ho6rWtHQZoJKQE/PbJk2WPPr7oznGzNj1lqUj4BMwIXU0gf0lxk9B6veL60LyCMqe3R55JeYad6blMfE5goNzu0EKdlWw3hWVvaZSYNNHxYFHVmDFXOfOC2hqOCARMwggEPMBAGCSsGAQQBnHgBAQQDAgEAMBQGCSsGAQQBnHgBAgQHFgVHZW5vYTARBgorBgEEAZx4AQMBBAMCAQowEQYKKwYBBAGceAEDAgQDAgEAMBEGCisGAQQBnHgBAwQEAwIBADARBgorBgEEAZx4AQMFBAMCAQAwEQYKKwYBBAGceAEDBgQDAgEAMBEGCisGAQQBnHgBAwcEAwIBADARBgorBgEEAZx4AQMDBAMCARcwEQYKKwYBBAGceAEDCAQDAgFUME0GCSsGAQQBnHgBBARAGvGqbB9WA3oFhJpZuIFc+QlYP5up7y8FMhjEN/M7oYPk5BWwObN/ggUlCtFfi4igo63Z9MCBwHeaSO0iFDeORDBBBgkqhkiG9w0BAQowNKAPMA0GCWCGSAFlAwQCAgUAoRwwGgYJKoZIhvcNAQEIMA0GCWCGSAFlAwQCAgUAogMCATADggIBACiat51tUhYQw3thZdSUbzRbfAZv5munoWgtW/sfC5EQNE2RhNMWNJCQw6V+cm026LNKoRmfwidMArkU+4VeivVZn6oNk7OFBkJI8Icl6gFpkmyHHmfgTSG5fHz6szhJ2RCnVimmF0aX92O/iwTkL/BerLcJPY90JApVbipTft+qjz9XhvBfV/j2DgDG+udbP3iGrhI0TDQwaNpXhiae8LAHbuTNezKWob9I4yXz2QfqZ2K/mnNFPLtQRlRE9m7bXx814B93cl2kXe5Z0QmAcBsVgUj3H/1Qs3RZYtwxH4SAuqqDKd0aT/G3S164zj8Oz4eS+lC+rEhR7HqSePd4H0TWegTr47A7aq9HkagAmSuTODesbnyAfclk94/PmtNX/EVw/q5gpdBiVkxwff8c9f2gZ5Yd6u3Nc0ANxc7nhTkJ4WirfL+s8vl3Mw7OozhINtASmXSt3a8I4EB+sxvJ/om5YTBwkvRrTsDnRfkoUP8SZlNiXhBzwOynbrrayJKFOm6G++SKBT2//QgoBy16pIo3YvfbrJqP+s28BKCI6BcbTH1oqjTIIre5pyoBvnhigsNjKP/hOo6SyZc15EzXM7vzK8VyJ9YNZbihuvOMvu41O3GmlY4zCv0GtWHlrCxblALN7oKTKw1y107us34Lq4sR2xRThoEZDDesUSeS+luP",
  "expiration_check_date_unix": 1780272000,
  "policy": {
    "expected_id_key_digest_hex": "ffffffffffffffffffffffffffffffffffffffffffffffffffffffffffffffffffffffffffffffffffffffffffffffff"
  }
}