{
  "schema_version": "1",
  "attestation_doc_b64": "H4sIAAAAAAAC/2NmgAFmBmIBIxBzgVniIepocsYUAkESgRIBwEBj0HE/I7fx05P5IYefL/yyaJ7bw6sG1fLF32yitG89mbarp+c/AQALR0lBRqzmxxUEV+aVZDhnJGbmrSIDwMzXMGdkAGEYn2GIgC+G+9e/vlfSNU8of8KWvlnsLndVr/ib52mJPY6Sr8xXb5zVrKTLK2/oMMvg8+Po3QUOuMyZ5y//1CCcW1FJzHuOGc+3D7wLll3dWHKLgykg4onIlhfWW1oP8N4Knxt01Edwvu2SvW4Mo2BQAADuflv8oAQAAA==",
  "vcek_der_b64": "MIIFQTCCAvWgAwIBAgIBAzBBBgkqhkiG9w0BAQowNKAPMA0GCWCGSAFlAwQCAgUAoRwwGgYJKoZIhvcNAQEIMA0GCWCGSAFlAwQCAgUAogMCATAwezEUMBIGA1UECwwLRW5naW5lZXJpbmcxCzAJBgNVBAYTAlVTMRQwEgYDVQQHDAtTYW50YSBDbGFyYTELMAkGA1UECAwCQ0ExHzAdBgNVBAoMFkFkdmFuY2VkIE1pY3JvIERldmljZXMxEjAQBgNVBAMMCVNFVi1HZW5vYTAgFw0yMDAxMDEwMDAwMDBaGA8yMDk5MDEwMTAwMDAwMFowejEUMBIGA1UECwwLRW5naW5lZXJpbmcxCzAJBgNVBAYTAlVTMRQwEgYDVQQHDAtTYW50YSBDbGFyYTELMAkGA1UECAwCQ0ExHzAdBgNVBAoMFkFkdmFuY2VkIE1pY3JvIERldmljZXMxETAPBgNVBAMMCFNFVi1WQ0VLMHYwEAYHKoZIzj0CAQYFK4EEACIDYgAEoNJUTdztrmOelQ/U5mBxjOUIR0kY9JYyBiDvjnPpHn43oyEQ5xwBxspu8Ajs48rwhwr3PD1SjzNfToZjdKk7dZT1Y9MLJGQUbDUSgfr916z3blpCvqOoEUVZ1VIdfkWDo4IBEzCCAQ8wEAYJKwYBBAGceAEBBAMCAQAwFAYJKwYBBAGceAECBAcWBUdlbm9hMBEGCisGAQQBnHgBAwEEAwIBBTARBgorBgEEAZx4AQMCBAMCAQAwEQYKKwYBBAGceAEDAwQDAgEXMBEGCisGAQQBnHgBAwQEAwIBADARBgorBgEEAZx4AQMFBAMCAQAwEQYKKwYBBAGceAEDBgQDAgEAMBEGCisGAQQBnHgBAwcEAwIBADARBgorBgEEAZx4AQMIBAMCAVQwTQYJKwYBBAGceAEEBEBecFN5bnRoQ2hhaW6qqqqqqqqqqqqqqqqqqqqqqqqqqqqqqqqqqqqqqqqqqqqqqqqqqqqqqqqqqqqqqqqqqqqqMEEGCSqGSIb3DQEBCjA0oA8wDQYJYIZIAWUDBAICBQChHDAaBgkqhkiG9w0BAQgwDQYJYIZIAWUDBAICBQCiAwIBMAOCAgEAie+kjraaDXheDs2QeCNPd8j2ATGP1obEZ8YxHuAC3MfgOuawHxt0PbDSr8xdDqW8PBftVpiJ58+453ZFvrOGXXcexR/FKMqGNNgtH+V0frQRrMAXTzTmDyCcFnW/BLB/5eE3i0qG6gBIYqr2WZmIab7Pye60+LCCocCc4qSSzLLXeRtWmkWlyInh194yf7PjvlFRvRYqQIgMs7lLYyQunM9S1C0qjBYeK5u1SIy7qJxBNM4XkLSZdV5+t2Mb75RiwGYOQjVYWdED1/XlFRdcmAjQKb1marIOZLKprlQfq3uylmd/p8QrPyV6Kpfn43oHbWQh29gJ0xf/XwiwaT4ucE5bV0iI4Xo+0zbtn6moS0HBBheRHoJZgCcv3RuTbSNQiX1zw5Gv8y8dUMQQ2Q47cuwl827V96Bmvid7l94JRWfdj47VXXcTq5eMIi3zkfdH6yALkm2pGjZjksum7NOnr9oY0kggGtWcRyUpy4Vnf7dZChC18MhQVXrDu5ruR7HAuNcUfV9O5f2+11lrPpdymdzvvnWgYQmaz0BIsuOFRQS7+rKxqnxfQ1yGV7xy+PAqSiYX5nvqPsfFEuUSu7slty+rC4EaRKK6MtippQXqNnGdknBUaZSQ9RNIgayd7BruX28s12DmOtHU/cZGlstQaLFhTN96zWRdM1GxrI5qflg=",
  "amd_root_ca_pem": "-----BEGIN CERTIFICATE-----\nMIIF7jCCA6KgAwIBAgIBATBBBgkqhkiG9w0BAQowNKAPMA0GCWCGSAFlAwQCAgUA\noRwwGgYJKoZIhvcNAQEIMA0GCWCGSAFlAwQCAgUAogMCATAwezEUMBIGA1UECwwL\nRW5naW5lZXJpbmcxCzAJBgNVBAYTAlVTMRQwEgYDVQQHDAtTYW50YSBDbGFyYTEL\nMAkGA1UECAwCQ0ExHzAdBgNVBAoMFkFkdmFuY2VkIE1pY3JvIERldmljZXMxEjAQ\nBgNVBAMMCUFSSy1HZW5vYTAgFw0yMDAxMDEwMDAwMDBaGA8yMDk5MDEwMTAwMDAw\nMFowezEUMBIGA1UECwwLRW5naW5lZXJpbmcxCzAJBgNVBAYTAlVTMRQwEgYDVQQH\nDAtTYW50YSBDbGFyYTELMAkGA1UECAwCQ0ExHzAdBgNVBAoMFkFkdmFuY2VkIE1p\nY3JvIERldmljZXMxEjAQBgNVBAMMCUFSSy1HZW5vYTCCAiIwDQYJKoZIhvcNAQEB\nBQADggIPADCCAgoCggIBAL5Hn8smMG1i4KwONSGwaEDz1728bKeHWpBF3VhsZ7dF\nYdXfVKXoRCcraZsx0HYdmnrs0tuDzDOBxmhcmZ4BB4IcwkmiLbv/KBsQ5bcvD6Nk\nIgfQvk1pgyi7TgBl+PhFE/4h4YzQZdpsiztMOWYLJyIm01HJJaiTuwuc8265hMor\n4X4ImtnPWe61YuhBSW8FGJpMWjHbpqsu1wtpxOoaeiwuoWuwt4VQS1XMg4eOo2Bu\nv17+tr/B/m55QDsfXjmDXWdb06lptdrQTovfH96ZTVjrEexULDynAw7CKtiowwsC\nRaO4UdpRbQDbuWbYgdGIHcCFdohixvvZ/bKFlLp755tgXmyGFDJhwD/rzbY3By+j\neQES6hvF6nS5Kdx76ZGE78OzRDvzNa8lubCZf6t+TAo7ZJYP9awESbOwCSWiJc5t\nHn3O0XvS98mwdw88cCqlFyIoYpBrmvRNXGrFH7pAHuKK6zC1Gav5ahYFHpmXl1Py\naR9iKK1fYPftVcUfwLk7EnyklZLPxHT8NjtRDrH+YCzTaDCL2LMrsEclzb71iXpw\n6b9ZY1ZET2+PdU2AzhxiB7FAU2WZwgJ53PKcCPXvMQzobfTudrsVtZEvwUXTy6Qh\nBItF9Y4Qg+AnF9GuHBN9Mb8AFZrZ5DNpsPGFuwMv3+3qcvZ5Cr1c8iB2iiEI/dcX\nAgMBAAGjEzARMA8GA1UdEwEB/wQFMAMBAf8wQQYJKoZIhvcNAQEKMDSgDzANBglg\nhkgBZQMEAgIFAKEcMBoGCSqGSIb3DQEBCDANBglghkgBZQMEAgIFAKIDAgEwA4IC\nAQBPNpTTNxIAfEsmLvpgLaHOCKYaUo9DCg/OXQ0CKdqfYeJ1NQYsDNHjunR5Nik/\nQiJC31Er65M9wKPcHC9faLoJYchosMPv261LvOH62yq3mW8pXmCv2nhUdxcBM6yy\nA91a3bCQlJOO+8t7u9cQxUvHXx+Jlll6huYtiyGK5mOWJVjk0Ci8dT6J7lh9zPe/\nNy3pTvvdR0OxxY9wa+eTB9HWqN27jr0D78WvekGHd5tbzKWxy5qTSpl/IWuc0vM4\n2jURcb58CEf5iEEaRFGbLmO0OKO0nIfpHkuQvEXrat40fHpsoKBrXhrPj+pRxTIW\nbzTThAF8K7Vt9Wi4hAi0pyDx8Y6zL5Xs/v6nUsM5fy7O8moooMqNCaJcyJJXCv0B\npNZi0C9rI400aPbZzaXBo1g8E/GpzLlx7WrJh9J4IC1UFkzsfB21nve8J7CZ63RU\nQK3hlgqcyCnq+ppRwE8OotypWDKD/CmZgT5Vhjgzjojjy7UhJAgZUuMCpHUUHC43\nFebF0LYbOzrAgvlL9gILVN1m1ccZ972m2QzXrhhAT/FRUa/bpjYv1sgsv3RxgaDq\n0piuHnwJtkQJxyozsIpbS9ACBPBapMLbLKCgS+LEdWzRowMsiVrqx4mgxEndrQTD\nDBTgt7n2ZW9uHmcCUCgZ+scOHaaNP491e+J5YN0L5/AXUw==\n-----END CERTIFICATE-----\n",
  "ask_pem": "-----BEGIN CERTIFICATE-----\nMIIF7jCCA6KgAwIBAgIBAjBBBgkqhkiG9w0BAQowNKAPMA0GCWCGSAFlAwQCAgUA\noRwwGgYJKoZIhvcNAQEIMA0GCWCGSAFlAwQCAgUAogMCATAwezEUMBIGA1UECwwL\nRW5naW5lZXJpbmcxCzAJBgNVBAYTAlVTMRQwEgYDVQQHDAtTYW50YSBDbGFyYTEL\nMAkGA1UECAwCQ0ExHzAdBgNVBAoMFkFkdmFuY2VkIE1pY3JvIERldmljZXMxEjAQ\nBgNVBAMMCUFSSy1HZW5vYTAgFw0yMDAxMDEwMDAwMDBaGA8yMDk5MDEwMTAwMDAw\nMFowezEUMBIGA1UECwwLRW5naW5lZXJpbmcxCzAJBgNVBAYTAlVTMRQwEgYDVQQH\nDAtTYW50YSBDbGFyYTELMAkGA1UECAwCQ0ExHzAdBgNVBAoMFkFkdmFuY2VkIE1p\nY3JvIERldmljZXMxEjAQBgNVBAMMCVNFVi1HZW5vYTCCAiIwDQYJKoZIhvcNAQEB\nBQADggIPADCCAgoCggIBANK/xNIOBMMwCX1q046qgyh1PdAZsc2hD8vI5KW3DYsz\niQVdNrEiZcLTlo4Vs3WT4C8AGxaSgrmNRAvP7dYobl1geC7e5Hf97OBS2rOurxTc\nX/kIXKZoqeTEvJ54W3t0243mCHDDM1DdFGPDymJ/qKsAn12XHy15TCJFYm1gplTr\nwUxMwT5bEljjQHLNKgHEqjuJ1sbPFYKwy4D5eKOVzNyR7ot6Mf/l3nwxlhRzm9kH\nx5D6sXuFBikFd99/ZWi1njBi0pluf9B44uADPOLvMU6XQreqCSK6MaabSpPpo25b\nGaiXBFiStqO90/Rc6Zii+X99GPSZbuebcaNoxBSf+wWxXwu+n93zOnOBJfMyFyPa\n0S3d745crfAb6nRkuvTp/0b1wW2QwuaUKZJhwwV7GAoEhjvvI2K9aLNJoEDyuT0I\nnOY+S/WVr/DzHxboI8GVzZftJOvSele+aewIKv/AtIWass6Q1tGdhG85sGOArSIY\n/Ut7EWrpvfywLL7DUbjKGHOudr33q52FF3OOJi9K3O+VhCPc2YDCvTh3YdPWj/ts\n2bStyNHpyoEI83crCpNI/5nJ0k8QKJLtWXxebTfV9jRO/bIJ8flWVrn1VFzAqapc\neaqVofdRHqPOoj1Blq9ryfZh5meey64sH+x325VYXzMpa86pyjxm/2t1zwgoNqJj\nAgMBAAGjEzARMA8GA1UdEwEB/wQFMAMBAf8wQQYJKoZIhvcNAQEKMDSgDzANBglg\nhkgBZQMEAgIFAKEcMBoGCSqGSIb3DQEBCDANBglghkgBZQMEAgIFAKIDAgEwA4IC\nAQBVP/LWLY77KddnAqwLyBHa47aO8Po2lGpdU7WQQxSI+wH1WkP7HAQJJN7uoHNV\nr71Pz366B42CpLzjIQAe4AG4dOacDK6LhCDUkdKXJsvj0RcAUPFWWTi9BWXCqJp9\n2MeGZDGihCQlO7nFfLQG++NLZNdc9nXvmKPfLy8gU7USG7w9RIzuRpllC920To4O\nssP7Rquvuleecji4LZuc+71+qElvQ1BFpFJTMd07KpFo3kGdFTNn6m3LR3fgfNd4\n+nEIokikD0EESOuVTG9eBQi5D9VM5Vc7Ndg0gejlLgB//IiMLTYKqLJwdD+PDUXM\naT+ykBLbZ48KKbZVokxwI78wQwKzrm7TNkBATqqy1VHbMoyszUStXvMsg27huYzg\nxMBhMo7t9YaTa0ofz4VQNQrSl6NzKfgR3vQHD7pxekyb1duFuuF4n5Bo5xTN8RB3\noHt3Sc1fcO35D90bo2Vxo0Wk8HOaQ6CFmOzfv0H1J7mXWaQBBP+lDxl/Rqrai1e1\n9KV8afS1y1w2KF0++BWpiybgodqQnZ1bLYt00DnqjI9SULbZ/C2aXC60Ak05+/OE\nHISuhSEnEI4HS8PEcV3tcXsr1kRjrWmdRKAtoaVe8o+wVeF1YH38JIJAhWeHxsyf\nzFMSkqi+e+nEVIof+t4fyU7peG3AN5LpLfavDcmoQ8xgUA==\n-----END CERTIFICATE-----\n",
  "expiration_check_date_unix": 1780272000
}