{
  "schema_version": "1",
  "attestation_doc_b64": "H4sIAAAAAAAC/2NmgAFmBmIBIxBzgVniIepocsYUAkESgRIBwEBj0HE/I7fx05P5IYefL/yyaJ7bw6sG1fLF32yitG89mbarp+c/AQALR0lBRqzmxxUEV+aVZDhnJGbmrSIDwMzXMGdkAGEYn2GIAMnECapyguUnDZUd501v8pyaIRzRcWzhhpXpFbLi4YsLtrWHr7LVqnyUeNt84ZXtCs9ccJnz9qPYgs1RzjKs2/21xI5dSIuTEGJS43/OuyK6svPzxnIb0ZN3Bab+NNh7WTO2TfrrMz6GUTAoAADMWMMRoAQAAA==",
  "vcek_der_b64": "MIIFQTCCAvWgAwIBAgIBAzBBBgkqhkiG9w0BAQowNKAPMA0GCWCGSAFlAwQCAgUAoRwwGgYJKoZIhvcNAQEIMA0GCWCGSAFlAwQCAgUAogMCATAwezEUMBIGA1UECwwLRW5naW5lZXJpbmcxCzAJBgNVBAYTAlVTMRQwEgYDVQQHDAtTYW50YSBDbGFyYTELMAkGA1UECAwCQ0ExHzAdBgNVBAoMFkFkdmFuY2VkIE1pY3JvIERldmljZXMxEjAQBgNVBAMMCVNFVi1HZW5vYTAgFw0yMDAxMDEwMDAwMDBaGA8yMDk5MDEwMTAwMDAwMFowejEUMBIGA1UECwwLRW5naW5lZXJpbmcxCzAJBgNVBAYTAlVTMRQwEgYDVQQHDAtTYW50YSBDbGFyYTELMAkGA1UECAwCQ0ExHzAdBgNVBAoMFkFkdmFuY2VkIE1pY3JvIERldmljZXMxETAPBgNVBAMMCFNFVi1WQ0VLMHYwEAYHKoZIzj0CAQYFK4EEACIDYgAE/OgvpXhQ2GVO27ihx2OqeYmKR8XN5rmgE3kDFWmVELDfoKXYfmMUfsAK7NJ7VB64PsBzoDP0uabEqykPAs9cI7u/dx1z2HBcajOMn4E8DaqN0FlYMO89UhJ/3+3c3kVpo4IBEzCCAQ8wEAYJKwYBBAGceAEBBAMCAQAwFAYJKwYBBAGceAECBAcWBUdlbm9hMBEGCisGAQQBnHgBAwEEAwIBCjARBgorBgEEAZx4AQMCBAMCAQAwEQYKKwYBBAGceAEDAwQDAgEXMBEGCisGAQQBnHgBAwQEAwIBADARBgorBgEEAZx4AQMFBAMCAQAwEQYKKwYBBAGceAEDBgQDAgEAMBEGCisGAQQBnHgBAwcEAwIBADARBgorBgEEAZx4AQMIBAMCAQowTQYJKwYBBAGceAEEBEBecFN5bnRoQ2hhaW6qqqqqqqqqqqqqqqqqqqqqqqqqqqqqqqqqqqqqqqqqqqqqqqqqqqqqqqqqqqqqqqqqqqqqMEEGCSqGSIb3DQEBCjA0oA8wDQYJYIZIAWUDBAICBQChHDAaBgkqhkiG9w0BAQgwDQYJYIZIAWUDBAICBQCiAwIBMAOCAgEAUoMsp7CI3YHSvWJ7vEmEgtOC5jwXxUMS9Q88L5jpPweWmLysJmJ+qgG4Uf1G35AexlG5vTlvnJ+ruV8qcKMieCCEs3ESQejw2QLXvYZGBMsZ1HcKZKa9N1g5ptDYxQg6jhfn3pSz3ih6RjzcU7H6axeoFLsODBPWvvqghD4chLzLZxdU9YtJMZK+osFRFqTQ9Kyw6VVFxiiJK0zzbRY0fXhBSiAuruSadVxG/OiNy9wgnJXFSzogtu1w9MYayhLQppQHVW6BGRq27jaA1Q8ZHpGOruNBQPSA2Yf/sDJl6iTXQBakeaVPcVmSxI361r4KSLyRsL68YA5wEEOgopTCnvY5TEXypR+qGpvWoW8Ue3BBxBT/RiLEYgLupHx1IeISHTl/BluZpXN86zl47Y/5SkyMk3iaUYsk2PldGlWmSv/xjGwoACBiNWjEarKsFYJBJEcJvRVWspi3hy8ay5FXzDuv5oxO6GdCDFzQvnuJEK91uPGahz9+wbOVF/mpEV/2z0T71D0PJDuCUVJD33RdEWKIdVnrl633f+qiV3RGhhXnP8bmi2cs27ojhBv5FkzzK8acizCyF41uMO2t9MXehf/ykI6Bf/CMQAq2PiTdkCE+z+DMU78qOSHHUx7PRFPkTE7/paxyyYgeb9rxeNocGmGje6MBfnVPhJ9fPVp8G9I=",
  "amd_root_ca_pem": "-----BEGIN CERTIFICATE-----\nMIIF7jCCA6KgAwIBAgIBATBBBgkqhkiG9w0BAQowNKAPMA0GCWCGSAFlAwQCAgUA\noRwwGgYJKoZIhvcNAQEIMA0GCWCGSAFlAwQCAgUAogMCATAwezEUMBIGA1UECwwL\nRW5naW5lZXJpbmcxCzAJBgNVBAYTAlVTMRQwEgYDVQQHDAtTYW50YSBDbGFyYTEL\nMAkGA1UECAwCQ0ExHzAdBgNVBAoMFkFkdmFuY2VkIE1pY3JvIERldmljZXMxEjAQ\nBgNVBAMMCUFSSy1HZW5vYTAgFw0yMDAxMDEwMDAwMDBaGA8yMDk5MDEwMTAwMDAw\nMFowezEUMBIGA1UECwwLRW5naW5lZXJpbmcxCzAJBgNVBAYTAlVTMRQwEgYDVQQH\nDAtTYW50YSBDbGFyYTELMAkGA1UECAwCQ0ExHzAdBgNVBAoMFkFkdmFuY2VkIE1p\nY3JvIERldmljZXMxEjAQBgNVBAMMCUFSSy1HZW5vYTCCAiIwDQYJKoZIhvcNAQEB\nBQADggIPADCCAgoCggIBALIKXSuX42BCe+M879K5ZR95ee6C7RO/QSJPHI9phM4D\nO0Lw1YPkxI8tVOlxpTaD/P2mqB3WzZBGLWaRijiq7lQKR0qP0o/qzvpVLt9ifWjQ\nFAXEakJ9nGSyiHJxt4f6/AdgmoJnj0cUDySML1Wno6FEPJTMqqqK5NbaBsFnqV+y\n0OwQtVzczILbIxQ2kLnZcYTqnwJg8l7JEBDxdS8pSAX9ZDiKgX3ouN/k0+Gt7juH\nqpYrW82sLBCSTyOiNWvauRsEoXRkt9gi4lVjbDqMt4kYwQo69XQLpsKYFVI2LBU+\nM763dN4iUaXdP53LuVeIsBMHool0tC9c6SirQMykPodP5YorMfvlK7NmvLfa/5I0\neKppjCQF2ESaPiDs3w0hiLe6UokDw6NMduxwMqjYoaq2BdzAMP+84HDDgVJk7dM6\nw6msTJf96bi07LANjWWKQxFvsOpsN2aaxHpIIUkbT2OxGtilNvxmLdQSmnzrUtdT\nGHPkeQ2VL7CkTQryRlFQUmJsB/rTIYv9Jae5x3rrfZO+7hJKK8Xwl4gI6hXxlFpj\nAO4TtDGyjhL6DxSXNOrlJsf1ZmhVt+sAReojUumJ0lch8Ongk8zzuCD0W90XSMsM\n7Z4tUUms2jd9+zbpxHDqRWRT1Bb4unMcNl1876bGVQWM5Ku4zXgctRr83ivwBer/\nAgMBAAGjEzARMA8GA1UdEwEB/wQFMAMBAf8wQQYJKoZIhvcNAQEKMDSgDzANBglg\nhkgBZQMEAgIFAKEcMBoGCSqGSIb3DQEBCDANBglghkgBZQMEAgIFAKIDAgEwA4IC\nAQBPSstgHo0wAs8KqcOEA64RHBQILHFnsoMgf++goBoUiyVGhtu4aFZazfs2Q81A\n6OOXjThfS+XjojI8jyNp/QvJ9SHDTVNa0nN76sQ8QsZOOKA8MMOoZe0s9CjlM5QL\n85/o96tfvTK0xuLPb95xqopXtKNlKCZVVUtxkW2fmqfBnR+SLixJyCbOt/GDaKax\nGa5aKgjCwrQjtIexPGP0LBYV4S/SCT97Y2YD7C9V6+ykgdwKIRiMqxkxnLzolgh6\nYX2yi+ElCsQcrN2ft/ev3+QeMLumKAtUFFQ9+zHtHCBnKBAvwyUu02mf/hvDrPv+\nMHwfObiQEJcWd2E2lShqsLJDHlXuwtdu85fYMIl4rfJ+Ckqb+DKsxCrqZOd6MBR3\nzTrJMNlf/+TJbG4rIPKAA0LkGQO8nVaYeGxTs3Eyf9b1eczTr/Aq7LGgz1fLJ0SA\nXrNXjMP0lbwmjwPQ0YRnIHaIqEuUTPI0tlGAyQkflJh/6qFwBvY+GGZDIU9MLgwK\n1kb57GHW8hg5x6LLsimVfdjJ20dJAWXU5JXzzPxJChgZcmF/8PJVl7lL/PDlh8ak\neWh+XpqClzBLbFF0+eV64bDioKlSC5+K2rFqzzuNacl4cAw91JE/OEmxqqwxoFm+\n7XISFlTG6vBtclu/y+f39oj55ENJdxzkKtGzSjiqs3QEiA==\n-----END CERTIFICATE-----\n",
  "ask_pem": "-----BEGIN CERTIFICATE-----\nMIIF7jCCA6KgAwIBAgIBAjBBBgkqhkiG9w0BAQowNKAPMA0GCWCGSAFlAwQCAgUA\noRwwGgYJKoZIhvcNAQEIMA0GCWCGSAFlAwQCAgUAogMCATAwezEUMBIGA1UECwwL\nRW5naW5lZXJpbmcxCzAJBgNVBAYTAlVTMRQwEgYDVQQHDAtTYW50YSBDbGFyYTEL\nMAkGA1UECAwCQ0ExHzAdBgNVBAoMFkFkdmFuY2VkIE1pY3JvIERldmljZXMxEjAQ\nBgNVBAMMCUFSSy1HZW5vYTAgFw0yMDAxMDEwMDAwMDBaGA8yMDk5MDEwMTAwMDAw\nMFowezEUMBIGA1UECwwLRW5naW5lZXJpbmcxCzAJBgNVBAYTAlVTMRQwEgYDVQQH\nDAtTYW50YSBDbGFyYTELMAkGA1UECAwCQ0ExHzAdBgNVBAoMFkFkdmFuY2VkIE1p\nY3JvIERldmljZXMxEjAQBgNVBAMMCVNFVi1HZW5vYTCCAiIwDQYJKoZIhvcNAQEB\nBQADggIPADCCAgoCggIBAL46iFJGdzZVxd4v2moEKCoEOsttlsIaKI9HTzZnDl71\nxmEJuKpqOVlU68mxuag/EMMM8F3zOP0Kg80O4oFMuRKs+mT16V3DyacT4+e4aEmR\npTNCPrRrqRuZ3vhkDcmeYos6lTjNll1xUB1Sl9D5n4Nox+gI0cr433iPJB65dpw+\nLRqwt4iLbzjSzvdwh2yWy8QQNjLpYk52SChexUaOX5OXphZuG3ATlDekPQbT7cVU\nSVu/VpqhFlj+EhdznAIu6rxuRL7e29X8LWHF1j+F8BlPTcsjEsf61zx7HXxesQ0q\nJ3ceJ6OrXOvbqxpcn0X2p230MHeterrHwV7SuqZHRWvYTW8XPNfUsgjOhCvNjZTB\n+sEo8Qla4Q2IiVndO9kKNmA+FGNLRJqqtxx0LzsqkJpuUq/BQTNY0iiltnrc/NOB\naONRAyWJmOcIzbOTdLm0jXipsllIdbwHgtwjluMz/Mkk//bvc8Ksa1hvQqZMDurA\nss3XyQPEGmy7fn3Mi5C6KAjUe25vYftIPIttHynvGCgHbPuJFQZivR53qx9Qn+ro\nglGQetCwRhjPB4kwfEVuk6TYC8Y6QAZ+wVs9v8f5L2Y4wC4XmThGCdgglbbCz/u9\njKZU+cifTT1PLlhChshUPqIEFz6OpLVlZs2vCLMvyjfmBF9HoI7jvONDJMfLV+mh\nAgMBAAGjEzARMA8GA1UdEwEB/wQFMAMBAf8wQQYJKoZIhvcNAQEKMDSgDzANBglg\nhkgBZQMEAgIFAKEcMBoGCSqGSIb3DQEBCDANBglghkgBZQMEAgIFAKIDAgEwA4IC\nAQBIv7oGHIPYGXBhlF3R2Xvy4WHr4pp1RkDmnlhrhNLsoib6+6CWqKutKoAv8ulR\ndVpWBqXKnCxXajkDTBsed09j/hXjgEbUxgus7VdM76BzKndVSXDB9hcemkRDyiFP\nXIr7bCSxiFZA6RrtpEw2GWcx9+YIXCgq8bmq7qIFS443DoJ4uj2UDM22LFcVsxT0\n80peDCrEaseeNtELbz4BBSzM1rKbqH5cYt/OD2EMgNKHBxcgSxQ45Dm+5TCHeC0e\nzcynKjzxqlJWBRu3At4SZNsd3z4UPoUI4Yt1NcaeX5+pdEKatvpw3BTu1+/RpkPt\niHj5uup1hOj950WOPrQWIqIy8ql+ZRJ2ccXxkFY1nR8ogq3kuGKmBEEZkAiwbgFl\nuanmivkjQgc7O1n3q/pllTWmdIuYbtAJmCpqBsemP5t1AyPHwdHo0aR3sSh4BJo6\nYfidY1ZjmEVDthNRm5PmdRv6DwSvSjWxxdrV++aK14BCdwYRPlpV3hS0uYxeudQB\nH75/CX4Yqh5HeDBnPOKnszorukfEHsBCS9dWCosRi7UJDxDCj7zujzkH34jw3Y/l\n5uIHhLKwIyahErD49ieIX+uhjGWFFRhCZCLDtyroy36cLVomD0d+Ma/ZKbm3SRW7\nXNuuelGtocyQbjOj4aFLlT2ESIK7OSR7eK8+uUg5OG1zVg==\n-----END CERTIFICATE-----\n",
  "expiration_check_date_unix": 1780272000
}